{"$schema":"https://json-schema.org/draft/2020-12/schema","title":"Candidate Pool","type":"object","additionalProperties":false,"required":["schema_version","status","selection_target","selection_rule","candidates"],"properties":{"schema_version":{"type":"string"},"status":{"enum":["draft","stable"]},"selection_target":{"type":"integer","minimum":1},"selection_rule":{"type":"string","minLength":1},"candidates":{"type":"array","items":{"type":"object","additionalProperties":false,"required":["candidate_id","subdomain_id","name","status"],"properties":{"candidate_id":{"type":"string","pattern":"^C-(AI|BIZ|PRO|SOC)-[A-Z]{3}-[0-9]{2}$"},"subdomain_id":{"type":"string","pattern":"^(AI|BIZ|PRO|SOC)\\.[A-Z]{3}$"},"name":{"type":"string","minLength":1},"status":{"enum":["selected","deferred","rejected"]},"competency_id":{"type":"string","pattern":"^(AI|BIZ|PRO|SOC)-[A-Z]{3}-[0-9]{3}$"},"reason":{"type":"string","minLength":1}},"allOf":[{"if":{"properties":{"status":{"const":"selected"}}},"then":{"required":["competency_id"]}},{"if":{"properties":{"status":{"enum":["deferred","rejected"]}}},"then":{"required":["reason"]}}]}}}}
