{
  "schema_version": "0.1.0",
  "status": "draft",
  "selection_target": 60,
  "selection_rule": "Each of the 12 subdomains contributes five selected candidates and one deferred candidate.",
  "candidates": [
    {"candidate_id":"C-AI-BND-01","subdomain_id":"AI.BND","name":"识别 AI 能力边界","status":"selected","competency_id":"AI-BND-001"},
    {"candidate_id":"C-AI-BND-02","subdomain_id":"AI.BND","name":"评估 AI 使用风险","status":"selected","competency_id":"AI-BND-002"},
    {"candidate_id":"C-AI-BND-03","subdomain_id":"AI.BND","name":"说明 AI 角色与来源","status":"selected","competency_id":"AI-BND-003"},
    {"candidate_id":"C-AI-BND-04","subdomain_id":"AI.BND","name":"设置人工监督点","status":"selected","competency_id":"AI-BND-004"},
    {"candidate_id":"C-AI-BND-05","subdomain_id":"AI.BND","name":"保护输入中的敏感信息","status":"selected","competency_id":"AI-BND-005"},
    {"candidate_id":"C-AI-BND-06","subdomain_id":"AI.BND","name":"评估 AI 使用的环境成本","status":"deferred","reason":"重要但对 12–18 岁基础课程的可观察教学情境仍需设计。"},
    {"candidate_id":"C-AI-COL-01","subdomain_id":"AI.COL","name":"组织人机协作","status":"selected","competency_id":"AI-COL-001"},
    {"candidate_id":"C-AI-COL-02","subdomain_id":"AI.COL","name":"构建有效任务上下文","status":"selected","competency_id":"AI-COL-002"},
    {"candidate_id":"C-AI-COL-03","subdomain_id":"AI.COL","name":"拆解 AI 辅助任务","status":"selected","competency_id":"AI-COL-003"},
    {"candidate_id":"C-AI-COL-04","subdomain_id":"AI.COL","name":"设计并迭代指令","status":"selected","competency_id":"AI-COL-004"},
    {"candidate_id":"C-AI-COL-05","subdomain_id":"AI.COL","name":"记录人机贡献","status":"selected","competency_id":"AI-COL-005"},
    {"candidate_id":"C-AI-COL-06","subdomain_id":"AI.COL","name":"协调多个 AI 工具","status":"deferred","reason":"容易绑定短期工具形态，需进一步验证可迁移边界。"},
    {"candidate_id":"C-AI-JUD-01","subdomain_id":"AI.JUD","name":"核验并纠正 AI 输出","status":"selected","competency_id":"AI-JUD-001"},
    {"candidate_id":"C-AI-JUD-02","subdomain_id":"AI.JUD","name":"识别输出偏差与遗漏","status":"selected","competency_id":"AI-JUD-002"},
    {"candidate_id":"C-AI-JUD-03","subdomain_id":"AI.JUD","name":"追溯来源与主张","status":"selected","competency_id":"AI-JUD-003"},
    {"candidate_id":"C-AI-JUD-04","subdomain_id":"AI.JUD","name":"比较备选输出","status":"selected","competency_id":"AI-JUD-004"},
    {"candidate_id":"C-AI-JUD-05","subdomain_id":"AI.JUD","name":"表达置信度与不确定性","status":"selected","competency_id":"AI-JUD-005"},
    {"candidate_id":"C-AI-JUD-06","subdomain_id":"AI.JUD","name":"量化评估模型表现","status":"deferred","reason":"更适合进阶技术路径，不作为所有青少年的基础节点。"},
    {"candidate_id":"C-BIZ-NED-01","subdomain_id":"BIZ.NED","name":"发现真实问题","status":"selected","competency_id":"BIZ-NED-001"},
    {"candidate_id":"C-BIZ-NED-02","subdomain_id":"BIZ.NED","name":"开展需求访谈","status":"selected","competency_id":"BIZ-NED-002"},
    {"candidate_id":"C-BIZ-NED-03","subdomain_id":"BIZ.NED","name":"观察行为与情境","status":"selected","competency_id":"BIZ-NED-003"},
    {"candidate_id":"C-BIZ-NED-04","subdomain_id":"BIZ.NED","name":"综合需求证据","status":"selected","competency_id":"BIZ-NED-004"},
    {"candidate_id":"C-BIZ-NED-05","subdomain_id":"BIZ.NED","name":"定义问题与机会","status":"selected","competency_id":"BIZ-NED-005"},
    {"candidate_id":"C-BIZ-NED-06","subdomain_id":"BIZ.NED","name":"量化市场细分","status":"deferred","reason":"当前更强调真实问题理解，市场规模方法留待进阶模块。"},
    {"candidate_id":"C-BIZ-PRO-01","subdomain_id":"BIZ.PRO","name":"构建可测试解决方案","status":"selected","competency_id":"BIZ-PRO-001"},
    {"candidate_id":"C-BIZ-PRO-02","subdomain_id":"BIZ.PRO","name":"根据反馈迭代方案","status":"selected","competency_id":"BIZ-PRO-002"},
    {"candidate_id":"C-BIZ-PRO-03","subdomain_id":"BIZ.PRO","name":"明确价值主张","status":"selected","competency_id":"BIZ-PRO-003"},
    {"candidate_id":"C-BIZ-PRO-04","subdomain_id":"BIZ.PRO","name":"确定产品范围与优先级","status":"selected","competency_id":"BIZ-PRO-004"},
    {"candidate_id":"C-BIZ-PRO-05","subdomain_id":"BIZ.PRO","name":"设计可访问的使用体验","status":"selected","competency_id":"BIZ-PRO-005"},
    {"candidate_id":"C-BIZ-PRO-06","subdomain_id":"BIZ.PRO","name":"设计完整商业模式","status":"deferred","reason":"概念跨度过大，需在价值、渠道和资源等节点成熟后再拆分。"},
    {"candidate_id":"C-BIZ-VAL-01","subdomain_id":"BIZ.VAL","name":"用真实反馈验证价值","status":"selected","competency_id":"BIZ-VAL-001"},
    {"candidate_id":"C-BIZ-VAL-02","subdomain_id":"BIZ.VAL","name":"设计最小验证","status":"selected","competency_id":"BIZ-VAL-002"},
    {"candidate_id":"C-BIZ-VAL-03","subdomain_id":"BIZ.VAL","name":"选择验证指标","status":"selected","competency_id":"BIZ-VAL-003"},
    {"candidate_id":"C-BIZ-VAL-04","subdomain_id":"BIZ.VAL","name":"解释冲突证据","status":"selected","competency_id":"BIZ-VAL-004"},
    {"candidate_id":"C-BIZ-VAL-05","subdomain_id":"BIZ.VAL","name":"依据验证决定下一步","status":"selected","competency_id":"BIZ-VAL-005"},
    {"candidate_id":"C-BIZ-VAL-06","subdomain_id":"BIZ.VAL","name":"预测市场规模","status":"deferred","reason":"预测误差和数据门槛较高，不作为基础市场验证能力。"},
    {"candidate_id":"C-PRO-PJM-01","subdomain_id":"PRO.PJM","name":"拆解项目目标","status":"selected","competency_id":"PRO-PJM-001"},
    {"candidate_id":"C-PRO-PJM-02","subdomain_id":"PRO.PJM","name":"管理项目风险与变更","status":"selected","competency_id":"PRO-PJM-002"},
    {"candidate_id":"C-PRO-PJM-03","subdomain_id":"PRO.PJM","name":"估算任务与资源","status":"selected","competency_id":"PRO-PJM-003"},
    {"candidate_id":"C-PRO-PJM-04","subdomain_id":"PRO.PJM","name":"协调里程碑与依赖","status":"selected","competency_id":"PRO-PJM-004"},
    {"candidate_id":"C-PRO-PJM-05","subdomain_id":"PRO.PJM","name":"完成项目收尾与复盘","status":"selected","competency_id":"PRO-PJM-005"},
    {"candidate_id":"C-PRO-PJM-06","subdomain_id":"PRO.PJM","name":"管理多项目组合","status":"deferred","reason":"超出多数青少年基础项目的责任范围。"},
    {"candidate_id":"C-PRO-COM-01","subdomain_id":"PRO.COM","name":"推进专业沟通","status":"selected","competency_id":"PRO-COM-001"},
    {"candidate_id":"C-PRO-COM-02","subdomain_id":"PRO.COM","name":"给予并运用专业反馈","status":"selected","competency_id":"PRO-COM-002"},
    {"candidate_id":"C-PRO-COM-03","subdomain_id":"PRO.COM","name":"撰写可行动工作文档","status":"selected","competency_id":"PRO-COM-003"},
    {"candidate_id":"C-PRO-COM-04","subdomain_id":"PRO.COM","name":"呈现并解释专业判断","status":"selected","competency_id":"PRO-COM-004"},
    {"candidate_id":"C-PRO-COM-05","subdomain_id":"PRO.COM","name":"主持有效会议","status":"selected","competency_id":"PRO-COM-005"},
    {"candidate_id":"C-PRO-COM-06","subdomain_id":"PRO.COM","name":"谈判外部合同","status":"deferred","reason":"涉及未成年人法律责任和复杂交易，不列为基础节点。"},
    {"candidate_id":"C-PRO-SEL-01","subdomain_id":"PRO.SEL","name":"自主管理行动与复盘","status":"selected","competency_id":"PRO-SEL-001"},
    {"candidate_id":"C-PRO-SEL-02","subdomain_id":"PRO.SEL","name":"管理注意力与工作节奏","status":"selected","competency_id":"PRO-SEL-002"},
    {"candidate_id":"C-PRO-SEL-03","subdomain_id":"PRO.SEL","name":"设定并修订个人目标","status":"selected","competency_id":"PRO-SEL-003"},
    {"candidate_id":"C-PRO-SEL-04","subdomain_id":"PRO.SEL","name":"主动求助并运用资源","status":"selected","competency_id":"PRO-SEL-004"},
    {"candidate_id":"C-PRO-SEL-05","subdomain_id":"PRO.SEL","name":"从失败中学习并迁移","status":"selected","competency_id":"PRO-SEL-005"},
    {"candidate_id":"C-PRO-SEL-06","subdomain_id":"PRO.SEL","name":"建立长期职业身份","status":"deferred","reason":"容易形成过早定型，与项目反对永久标签的原则冲突。"},
    {"candidate_id":"C-SOC-AWR-01","subdomain_id":"SOC.AWR","name":"理解利益相关者","status":"selected","competency_id":"SOC-AWR-001"},
    {"candidate_id":"C-SOC-AWR-02","subdomain_id":"SOC.AWR","name":"识别权力差异与公共影响","status":"selected","competency_id":"SOC-AWR-002"},
    {"candidate_id":"C-SOC-AWR-03","subdomain_id":"SOC.AWR","name":"理解差异化视角","status":"selected","competency_id":"SOC-AWR-003"},
    {"candidate_id":"C-SOC-AWR-04","subdomain_id":"SOC.AWR","name":"识别社会规范与情境","status":"selected","competency_id":"SOC-AWR-004"},
    {"candidate_id":"C-SOC-AWR-05","subdomain_id":"SOC.AWR","name":"评估非预期影响","status":"selected","competency_id":"SOC-AWR-005"},
    {"candidate_id":"C-SOC-AWR-06","subdomain_id":"SOC.AWR","name":"分析制度系统","status":"deferred","reason":"范围过大，需进一步限定适合青少年的可行动边界。"},
    {"candidate_id":"C-SOC-COL-01","subdomain_id":"SOC.COL","name":"协同完成共同任务","status":"selected","competency_id":"SOC-COL-001"},
    {"candidate_id":"C-SOC-COL-02","subdomain_id":"SOC.COL","name":"协商分歧与共同决策","status":"selected","competency_id":"SOC-COL-002"},
    {"candidate_id":"C-SOC-COL-03","subdomain_id":"SOC.COL","name":"建立团队协作约定","status":"selected","competency_id":"SOC-COL-003"},
    {"candidate_id":"C-SOC-COL-04","subdomain_id":"SOC.COL","name":"维护共享责任","status":"selected","competency_id":"SOC-COL-004"},
    {"candidate_id":"C-SOC-COL-05","subdomain_id":"SOC.COL","name":"修复协作中的信任","status":"selected","competency_id":"SOC-COL-005"},
    {"candidate_id":"C-SOC-COL-06","subdomain_id":"SOC.COL","name":"调解高风险冲突","status":"deferred","reason":"可能涉及专业调解与安全责任，不宜作为一般基础能力。"},
    {"candidate_id":"C-SOC-RUL-01","subdomain_id":"SOC.RUL","name":"遵守规则并承担责任","status":"selected","competency_id":"SOC-RUL-001"},
    {"candidate_id":"C-SOC-RUL-02","subdomain_id":"SOC.RUL","name":"保护隐私与知情同意","status":"selected","competency_id":"SOC-RUL-002"},
    {"candidate_id":"C-SOC-RUL-03","subdomain_id":"SOC.RUL","name":"尊重版权与正确署名","status":"selected","competency_id":"SOC-RUL-003"},
    {"candidate_id":"C-SOC-RUL-04","subdomain_id":"SOC.RUL","name":"安全地公开发布","status":"selected","competency_id":"SOC-RUL-004"},
    {"candidate_id":"C-SOC-RUL-05","subdomain_id":"SOC.RUL","name":"披露 AI 使用并保留问责记录","status":"selected","competency_id":"SOC-RUL-005"},
    {"candidate_id":"C-SOC-RUL-06","subdomain_id":"SOC.RUL","name":"解释跨地区法律差异","status":"deferred","reason":"高度依赖司法辖区，应由专业人士和成人承担主要责任。"}
  ]
}
